{
    "dateFormat": "d-M-Y",
    "ublSupportEnabled": false,
    "symfonyValidationEnabled": true,
    "xsdValidationEnabled": true,
    "kositValidationEnabled": true,
    "accounts": [
        {
            "identifier": "3ACD7956-A9BB-427B-A0C6-0F347A485D74",
            "host": "127.0.0.1",
            "port": 993,
            "protocol": "imap",
            "encryption": "tls",
            "validateCert": true,
            "username": "demouser",
            "password": "demopassword",
            "authentication": null,
            "timeout": 30,
            "foldersToWatch": [
                "INBOX",
                "INBOX\/somefolder"
            ],
            "mimeTypesToWatch": [
                "text\/xml",
                "application\/pdf"
            ],
            "handlers": [
                {
                    "classname": "horstoeko\\zugferdmail\\handlers\\ZugferdMailHandlerNull",
                    "properties": {}
                },
                {
                    "classname": "horstoeko\\zugferdmail\\handlers\\ZugferdMailHandlerCopyMessage",
                    "properties": {
                        "copyToFolder": "INBOX\/someotherfolder"
                    }
                }
            ]
        }
    ]
}